{
  "artifact_id": "V0_IPEC_WP6_GATE2_AUDIT_RESULT",
  "contract_id": "V0-IPEC-0.1",
  "version": "0.1",
  "date": "2026-07-19",
  "status": "HOLD",
  "decision": "HOLD_FOR_HOSTED_CI",
  "gate2_closed": false,
  "closure_eligible": false,
  "gate_summary": {
    "total": 20,
    "pass": 19,
    "pending": 1,
    "fail": 0
  },
  "metrics": {
    "theorem_owners": 36,
    "unique_theorem_ids": 36,
    "theorem_rule_bindings": 36,
    "unmapped": 0,
    "validator_rules": 36,
    "unique_rule_ids": 36,
    "adapter_bindings": 40,
    "typed_outcomes": 8,
    "procedural_bindings": 11,
    "negative_fixtures": 24,
    "negative_fixtures_rejected": 24,
    "typed_outcomes_exercised": 8,
    "ci_jobs": 12,
    "conditional_theorems": [
      "T140",
      "T150",
      "T156"
    ],
    "local_replay_digest": "f7cb3a0ced2f396ca59ebb6a02ff165589b3eb70761dbf8304dbd47e5555982b"
  },
  "single_blocker": "G2-20: authentic green GitHub Actions evidence for four hosted upstream replay jobs is not recorded.",
  "audit_payload_sha256": "25d7e370930e73e2120e44a18418695567b91cb1b74ac481e615479fb308fd04",
  "frozen_upstreams_modified": false
}
